{"$schema":"https://json-schema.org/draft/2020-12/schema","additionalProperties":false,"properties":{"attempt_1":{"additionalProperties":false,"properties":{"adapter_executed":{"const":false},"attempt_number":{"const":1},"capture_error_code":{"const":"ACCEPTANCE_JSON_NOT_CANONICAL"},"capture_failure_stage":{"const":"CAPTURE"},"capture_result":{"const":"FAIL"},"codex_observed":{"const":false},"credential_accessed":{"const":false},"evidence_recreated":{"const":false},"execution":{"const":"COMPLETED_READ_ONLY"},"ha_network_attempted":{"const":false},"historical_failed_run_directory":{"const":"C:\\Users\\JorgeAzofeifaCastill\\AppData\\Local\\HIOC\\evidence\\pe4\\independent-acceptance\\16b7dd412cde7503ea45c62734915096654aa690\\20261007T144645-b79becafb543"},"inspection_semantic_result":{"const":"PASS"},"manifest_json_published":{"const":false},"production_mutated":{"const":false},"provenance":{"const":"OPERATOR_SUPPLIED_WINDOWS_AND_PRODUCTION_EXECUTION_EVIDENCE"},"raw_stdout_durably_available":{"const":false},"raw_stdout_revalidation":{"const":"UNAVAILABLE"},"remote_return_code":{"const":0},"remote_stderr_present":{"const":false},"sanitized_stdout_bytes_observed":{"const":560},"scheduler_mutated":{"const":false},"second_adapter_execution_authorized":{"const":false},"ssh_stderr_discarded":{"const":false},"validation_json_published":{"const":false}},"required":["adapter_executed","attempt_number","capture_error_code","capture_failure_stage","capture_result","codex_observed","credential_accessed","evidence_recreated","execution","ha_network_attempted","historical_failed_run_directory","inspection_semantic_result","manifest_json_published","production_mutated","provenance","raw_stdout_durably_available","raw_stdout_revalidation","remote_return_code","remote_stderr_present","sanitized_stdout_bytes_observed","scheduler_mutated","second_adapter_execution_authorized","ssh_stderr_discarded","validation_json_published"],"type":"object"},"attempt_2":{"additionalProperties":false,"properties":{"acceptance_result":{"const":"PASS"},"activity":{"additionalProperties":false,"properties":{"ADAPTER_EXECUTED":{"const":false},"CREDENTIAL_ACCESSED":{"const":false},"HA_NETWORK_ATTEMPTED":{"const":false},"PRODUCTION_MUTATED":{"const":false}},"required":["ADAPTER_EXECUTED","CREDENTIAL_ACCESSED","HA_NETWORK_ATTEMPTED","PRODUCTION_MUTATED"],"type":"object"},"attempt_number":{"const":2},"automatic_retry":{"const":false},"codex_observed":{"const":false},"error_code":{"const":"NONE"},"evidence_directory_accessed_by_codex":{"const":false},"evidence_parent":{"const":"C:\\Users\\JorgeAzofeifaCastill\\AppData\\Local\\HIOC\\evidence\\pe4\\independent-acceptance\\400f157e1815a0960fba38ac1a92b93a7dda37eb"},"evidence_review":{"const":"PASS"},"execution_provenance":{"const":"OPERATOR_SUPPLIED_WINDOWS_AND_PRODUCTION_EXECUTION_EVIDENCE"},"failure_stage":{"const":"NONE"},"file_names":{"items":false,"maxItems":2,"minItems":2,"prefixItems":[{"const":"manifest.json"},{"const":"validation.json"}],"type":"array"},"gates":{"additionalProperties":false,"properties":{"CHECKPOINT_COUNTS_AGREE":{"const":"PASS"},"COMPATIBILITY":{"const":"PASS"},"CRON_SCHEDULER":{"const":"PASS"},"DEPLOYMENT":{"const":"PASS"},"INVENTORY":{"const":"PASS"},"PRIVATE_STATE":{"const":"PASS"},"PROTECTED_SURFACES_UNCHANGED":{"const":"PASS"},"RUNTIME":{"const":"PASS"}},"required":["CHECKPOINT_COUNTS_AGREE","COMPATIBILITY","CRON_SCHEDULER","DEPLOYMENT","INVENTORY","PRIVATE_STATE","PROTECTED_SURFACES_UNCHANGED","RUNTIME"],"type":"object"},"manifest_binding":{"const":"PASS"},"manifest_bytes":{"const":194},"manifest_sha256":{"const":"14bfbb72b19082b565c0258efde2ae956cc7d00fe2da3b492be2ca376c7f0943"},"manifest_source_commit":{"const":"400f157e1815a0960fba38ac1a92b93a7dda37eb"},"manifest_validation_bytes":{"const":560},"manifest_validation_sha256":{"const":"b6dc423c243dba496dfb2f22918cafc8ee2e61566a2baac5a6bc67d5522f826f"},"operator_result":{"const":"PASS"},"original_ephemeral_evidence_limitation":{"const":"RECORDED"},"original_ephemeral_evidence_revalidation":{"const":"UNAVAILABLE"},"raw_evidence_committed":{"const":false},"remote_return_code":{"const":0},"remote_return_code_basis":{"const":"GOVERNED_OPERATOR_PASS_IMPLIES_VALIDATED_PASS_RC0"},"review_pi3_access":{"const":false},"review_production_mutation":{"const":false},"review_provenance":{"const":"OPERATOR_SUPPLIED_WINDOWS_EVIDENCE_REVIEW"},"run_directory_count":{"const":1},"run_id":{"const":"20261007T220653-46cef5aace9e"},"security":{"additionalProperties":false,"properties":{"manifest_acl_protected":{"const":true},"manifest_owner":{"const":"AzureAD\\JorgeAzofeifaCastill"},"run_acl_protected":{"const":true},"run_owner":{"const":"AzureAD\\JorgeAzofeifaCastill"},"validation_acl_protected":{"const":true},"validation_owner":{"const":"AzureAD\\JorgeAzofeifaCastill"}},"required":["manifest_acl_protected","manifest_owner","run_acl_protected","run_owner","validation_acl_protected","validation_owner"],"type":"object"},"source_commit":{"const":"400f157e1815a0960fba38ac1a92b93a7dda37eb"},"status":{"const":"PASS"},"stop_required":{"const":true},"validation_bytes":{"const":560},"validation_sha256":{"const":"b6dc423c243dba496dfb2f22918cafc8ee2e61566a2baac5a6bc67d5522f826f"}},"required":["acceptance_result","activity","attempt_number","automatic_retry","codex_observed","error_code","evidence_directory_accessed_by_codex","evidence_parent","evidence_review","execution_provenance","failure_stage","file_names","gates","manifest_binding","manifest_bytes","manifest_sha256","manifest_source_commit","manifest_validation_bytes","manifest_validation_sha256","operator_result","original_ephemeral_evidence_limitation","original_ephemeral_evidence_revalidation","raw_evidence_committed","remote_return_code","remote_return_code_basis","review_pi3_access","review_production_mutation","review_provenance","run_directory_count","run_id","security","source_commit","status","stop_required","validation_bytes","validation_sha256"],"type":"object"},"closure_predecessor":{"const":"400f157e1815a0960fba38ac1a92b93a7dda37eb"},"future_execution_requires_separate_authorization":{"const":true},"lifecycle":{"additionalProperties":false,"properties":{"attempt_1":{"const":"FAIL_DURABLE_CAPTURE"},"attempt_2":{"const":"PASS"},"independent_production_acceptance":{"const":"PASS_CLOSED"},"pe4":{"const":"NOT_COMPLETE"},"phase7a":{"const":"ACTIVE"},"projection":{"const":"DEFERRED"},"rollback":{"const":"NOT_PERFORMED"},"scheduler":{"const":"NOT_STARTED"},"second_adapter_execution_authorized":{"const":false}},"required":["attempt_1","attempt_2","independent_production_acceptance","pe4","phase7a","projection","rollback","scheduler","second_adapter_execution_authorized"],"type":"object"},"negative_evidence_by_codex":{"additionalProperties":false,"properties":{"acceptance_execution":{"const":false},"adapter_execution":{"const":false},"credential_access":{"const":false},"ha_access":{"const":false},"historical_evidence_recreation":{"const":false},"pi3_access":{"const":false},"pi5_access":{"const":false},"production_execution":{"const":false},"production_mutation":{"const":false},"public_projection":{"const":false},"reconciler_execution":{"const":false},"remote_wrapper_execution":{"const":false},"retained_windows_evidence_access":{"const":false},"rollback":{"const":false},"scheduler_mutation":{"const":false},"surveillance":{"const":false},"windows_operator_execution":{"const":false}},"required":["acceptance_execution","adapter_execution","credential_access","ha_access","historical_evidence_recreation","pi3_access","pi5_access","production_execution","production_mutation","public_projection","reconciler_execution","remote_wrapper_execution","retained_windows_evidence_access","rollback","scheduler_mutation","surveillance","windows_operator_execution"],"type":"object"},"next_objective":{"const":"PE-4 Home Assistant Association Adapter Scheduler Deployment"},"next_objective_status":{"const":"NOT_STARTED"},"next_operator_action":{"const":"PI3_SOURCE_SYNCHRONIZATION_TO_CLOSURE_COMMIT_ONLY_STOP_INDEPENDENT_REVIEW"},"original_ephemeral_evidence_limitation":{"additionalProperties":false,"properties":{"disappearance_cause":{"const":"UNKNOWN"},"execution_time_comparison_recreated":{"const":false},"historical_evidence_recreated":{"const":false},"limitation":{"const":"RECORDED"},"present":{"const":false},"revalidation":{"const":"UNAVAILABLE"}},"required":["disappearance_cause","execution_time_comparison_recreated","historical_evidence_recreated","limitation","present","revalidation"],"type":"object"},"predecessor_parent":{"const":"27377b95658010bf35c2b1fab8009de3d6f24bb6"},"predecessor_subject":{"const":"PE-4: harden independent acceptance operator path"},"prerequisites":{"additionalProperties":false,"properties":{"capture_correction":{"const":"PASS_CLOSED"},"native_windows_durability":{"const":"PASS"},"operator_path_integration":{"const":"PASS_CLOSED"},"pi3_source_synchronization":{"const":"PASS"},"preparation":{"const":"PASS_CLOSED"},"separate_attempt_2_authorization":{"const":"OPERATOR_SUPPLIED_COMPLETED"},"separate_durable_evidence_review":{"const":"PASS"}},"required":["capture_correction","native_windows_durability","operator_path_integration","pi3_source_synchronization","preparation","separate_attempt_2_authorization","separate_durable_evidence_review"],"type":"object"},"privacy":{"const":"SANITIZED_OPERATOR_SUPPLIED_METADATA_AND_HASH_IDENTITIES_ONLY_NO_RAW_EVIDENCE"},"record_type":{"const":"PE4_HA_ASSOCIATION_INDEPENDENT_PRODUCTION_ACCEPTANCE_CLOSURE"},"repository_validation":{"additionalProperties":false,"properties":{"diff_check":{"const":"PASS"},"environment":{"const":"SIGNED_IN_NATIVE_WINDOWS_CPYTHON_3_12_14_GIT_VISIBLE_BASH_SH_UNAVAILABLE_HIOC_TEST_SHELL_UNSET"},"focused":{"additionalProperties":false,"properties":{"errors":{"const":0},"failures":{"const":0},"passed":{"const":21},"run":{"const":21},"skipped":{"const":0}},"required":["errors","failures","passed","run","skipped"],"type":"object"},"full_runs":{"items":false,"maxItems":2,"minItems":2,"prefixItems":[{"additionalProperties":false,"properties":{"errors":{"const":0},"failure":{"const":"test_pe4_ha_auth_capability_client.ClientTests.test_run_stalled_send_failure_output_is_private"},"failures":{"const":1},"interpretation":{"const":"TIMING_SENSITIVITY_INFERRED_FROM_EXISTING_20MS_BUDGET_AND_FIVE_UNCHANGED_ISOLATED_PASSES"},"observed":{"const":"EXPECTED_ONE_SEND_OBSERVED_ZERO"},"passed":{"const":2000},"result":{"const":"FAIL"},"run":{"const":2048},"skipped":{"const":47}},"required":["errors","failure","failures","interpretation","observed","passed","result","run","skipped"],"type":"object"},{"additionalProperties":false,"properties":{"errors":{"const":0},"failures":{"const":0},"passed":{"const":2001},"result":{"const":"PASS"},"run":{"const":2048},"skipped":{"const":47}},"required":["errors","failures","passed","result","run","skipped"],"type":"object"}],"type":"array"},"full_suite_repeated_without_test_suppression":{"const":true},"provenance":{"const":"CODEX_OBSERVED_REPOSITORY_ONLY_LOCAL_SYNTHETIC_WINDOWS_TESTS"},"relevant_pe4":{"additionalProperties":false,"properties":{"errors":{"const":0},"failures":{"const":0},"passed":{"const":1307},"pattern":{"const":"test_pe4*.py"},"run":{"const":1323},"skipped":{"const":16}},"required":["errors","failures","passed","pattern","run","skipped"],"type":"object"},"runtime_and_existing_governance_unchanged":{"const":true},"unchanged_failed_test_isolated_recheck":{"additionalProperties":false,"properties":{"errors":{"const":0},"failures":{"const":0},"passed":{"const":5},"run":{"const":5}},"required":["errors","failures","passed","run"],"type":"object"}},"required":["diff_check","environment","focused","full_runs","full_suite_repeated_without_test_suppression","provenance","relevant_pe4","runtime_and_existing_governance_unchanged","unchanged_failed_test_isolated_recheck"],"type":"object"},"schema_version":{"const":"1.0"},"source_synchronization":{"additionalProperties":false,"properties":{"actions":{"additionalProperties":false,"properties":{"acceptance_execution":{"const":false},"adapter_execution":{"const":false},"attempt_2_started":{"const":false},"credential_access":{"const":false},"ha_network":{"const":false},"production_mutation":{"const":false},"reconciler_execution":{"const":false},"scheduler_mutation":{"const":false},"second_adapter_execution_authorized":{"const":false}},"required":["acceptance_execution","adapter_execution","attempt_2_started","credential_access","ha_network","production_mutation","reconciler_execution","scheduler_mutation","second_adapter_execution_authorized"],"type":"object"},"active_git_operation":{"const":false},"ahead":{"const":0},"behind":{"const":0},"branch_after":{"const":"main"},"branch_before":{"const":"main"},"changeset_count":{"const":14},"changeset_validation":{"const":"PASS"},"final_operator_artifact_identity":{"const":"PASS"},"head_after":{"const":"400f157e1815a0960fba38ac1a92b93a7dda37eb"},"head_before":{"const":"16b7dd412cde7503ea45c62734915096654aa690"},"intermediate_commit":{"const":"27377b95658010bf35c2b1fab8009de3d6f24bb6"},"intermediate_subject":{"const":"PE-4: correct independent acceptance capture"},"origin_main_after":{"const":"400f157e1815a0960fba38ac1a92b93a7dda37eb"},"provenance":{"const":"OPERATOR_SUPPLIED"},"result":{"const":"PASS"},"return_code":{"const":0},"subject_validation":{"const":"PASS"},"successor_commit_count":{"const":2},"target_subject":{"const":"PE-4: harden independent acceptance operator path"},"two_commit_parent_chain":{"const":"PASS"},"worktree_clean_after":{"const":true},"worktree_clean_before":{"const":true}},"required":["actions","active_git_operation","ahead","behind","branch_after","branch_before","changeset_count","changeset_validation","final_operator_artifact_identity","head_after","head_before","intermediate_commit","intermediate_subject","origin_main_after","provenance","result","return_code","subject_validation","successor_commit_count","target_subject","two_commit_parent_chain","worktree_clean_after","worktree_clean_before"],"type":"object"},"sources":{"items":false,"maxItems":8,"minItems":8,"prefixItems":[{"additionalProperties":false,"properties":{"commit":{"const":"400f157e1815a0960fba38ac1a92b93a7dda37eb"},"git_blob":{"const":"f771a3355f7fcaeb3cffe48ef2a57ab487c229a4"},"path":{"const":"governance/pe4/pe4-ha-association-independent-production-acceptance-operator-path.json"},"sha256":{"const":"d2ddce1ef2a173b5c1ed94e0426efcba5ddae7b0ca50d067120f748df8cb23c5"}},"required":["commit","git_blob","path","sha256"],"type":"object"},{"additionalProperties":false,"properties":{"commit":{"const":"400f157e1815a0960fba38ac1a92b93a7dda37eb"},"git_blob":{"const":"61fb0b5215eaa4aefca164d25c259f11b841d975"},"path":{"const":"governance/pe4/pe4-ha-association-independent-production-acceptance-capture-correction.json"},"sha256":{"const":"e1beddfca36153e9695ea712daa91e08414bc865afbf785b91fd13c79560ad85"}},"required":["commit","git_blob","path","sha256"],"type":"object"},{"additionalProperties":false,"properties":{"commit":{"const":"400f157e1815a0960fba38ac1a92b93a7dda37eb"},"git_blob":{"const":"d2d32ac29f579b7930795990d8d0db46dd048132"},"path":{"const":"governance/pe4/pe4-ha-association-independent-production-acceptance-preparation.json"},"sha256":{"const":"5187fd4fb18a18218e95b9c7732598738249296bfb9a9a23afdcdbd259bb16a8"}},"required":["commit","git_blob","path","sha256"],"type":"object"},{"additionalProperties":false,"properties":{"commit":{"const":"400f157e1815a0960fba38ac1a92b93a7dda37eb"},"git_blob":{"const":"08e0e4012185315b5bb801cf8cc68bb01eff5350"},"path":{"const":"governance/pe4/pe4-ha-association-durable-post-run-reconciliation-closure.json"},"sha256":{"const":"d5bf759331e95950bb5bc5a69310dfc502ffb67572fc363208c5c592fadfe983"}},"required":["commit","git_blob","path","sha256"],"type":"object"},{"additionalProperties":false,"properties":{"commit":{"const":"400f157e1815a0960fba38ac1a92b93a7dda37eb"},"git_blob":{"const":"2cd256b160793d71ce502041edb73046e8487d04"},"path":{"const":"docs/HIOC_MASTER_PLAN.md"},"sha256":{"const":"82ad201a5694bd267b617f9c70bac0850e25611ea697850722db7c1c0579a7c3"}},"required":["commit","git_blob","path","sha256"],"type":"object"},{"additionalProperties":false,"properties":{"commit":{"const":"400f157e1815a0960fba38ac1a92b93a7dda37eb"},"git_blob":{"const":"76238bf0e821121f14d0d92f1913bc308da11a10"},"path":{"const":"tools/hioc-pe4-ha-association-independent-acceptance.py"},"sha256":{"const":"fddc9c15ce9fd32fcc50c9d9506fa356e9f0dd3201e8a8d7efe8af8db8d90101"}},"required":["commit","git_blob","path","sha256"],"type":"object"},{"additionalProperties":false,"properties":{"commit":{"const":"400f157e1815a0960fba38ac1a92b93a7dda37eb"},"git_blob":{"const":"68377e945caae0c8b239702d699405de9685868c"},"path":{"const":"tools/hioc-pe4-ha-association-acceptance-operator.py"},"sha256":{"const":"06e55c7a7ae526b882c20d41adcb15190473919beb56562c09436f7e4841f720"}},"required":["commit","git_blob","path","sha256"],"type":"object"},{"additionalProperties":false,"properties":{"commit":{"const":"400f157e1815a0960fba38ac1a92b93a7dda37eb"},"git_blob":{"const":"38a026a5f664a71a6736606c00037ceb6861f34a"},"path":{"const":"tools/hioc-pe4-ha-association-acceptance-capture.py"},"sha256":{"const":"62828b6f4883a8bdac06d8f4964e859b2788d4a06547541bcccc013a0fd99320"}},"required":["commit","git_blob","path","sha256"],"type":"object"}],"type":"array"},"status":{"const":"PASS_CLOSED"}},"required":["attempt_1","attempt_2","closure_predecessor","future_execution_requires_separate_authorization","lifecycle","negative_evidence_by_codex","next_objective","next_objective_status","next_operator_action","original_ephemeral_evidence_limitation","predecessor_parent","predecessor_subject","prerequisites","privacy","record_type","repository_validation","schema_version","source_synchronization","sources","status"],"type":"object"}
