{"attempt_1":{"adapter_executed":false,"attempt_number":1,"capture_error_code":"ACCEPTANCE_JSON_NOT_CANONICAL","capture_failure_stage":"CAPTURE","capture_result":"FAIL","codex_observed":false,"credential_accessed":false,"evidence_recreated":false,"execution":"COMPLETED_READ_ONLY","ha_network_attempted":false,"historical_failed_run_directory":"C:\\Users\\JorgeAzofeifaCastill\\AppData\\Local\\HIOC\\evidence\\pe4\\independent-acceptance\\16b7dd412cde7503ea45c62734915096654aa690\\20261007T144645-b79becafb543","inspection_semantic_result":"PASS","manifest_json_published":false,"production_mutated":false,"provenance":"OPERATOR_SUPPLIED_WINDOWS_AND_PRODUCTION_EXECUTION_EVIDENCE","raw_stdout_durably_available":false,"raw_stdout_revalidation":"UNAVAILABLE","remote_return_code":0,"remote_stderr_present":false,"sanitized_stdout_bytes_observed":560,"scheduler_mutated":false,"second_adapter_execution_authorized":false,"ssh_stderr_discarded":false,"validation_json_published":false},"attempt_2":{"acceptance_result":"PASS","activity":{"ADAPTER_EXECUTED":false,"CREDENTIAL_ACCESSED":false,"HA_NETWORK_ATTEMPTED":false,"PRODUCTION_MUTATED":false},"attempt_number":2,"automatic_retry":false,"codex_observed":false,"error_code":"NONE","evidence_directory_accessed_by_codex":false,"evidence_parent":"C:\\Users\\JorgeAzofeifaCastill\\AppData\\Local\\HIOC\\evidence\\pe4\\independent-acceptance\\400f157e1815a0960fba38ac1a92b93a7dda37eb","evidence_review":"PASS","execution_provenance":"OPERATOR_SUPPLIED_WINDOWS_AND_PRODUCTION_EXECUTION_EVIDENCE","failure_stage":"NONE","file_names":["manifest.json","validation.json"],"gates":{"CHECKPOINT_COUNTS_AGREE":"PASS","COMPATIBILITY":"PASS","CRON_SCHEDULER":"PASS","DEPLOYMENT":"PASS","INVENTORY":"PASS","PRIVATE_STATE":"PASS","PROTECTED_SURFACES_UNCHANGED":"PASS","RUNTIME":"PASS"},"manifest_binding":"PASS","manifest_bytes":194,"manifest_sha256":"14bfbb72b19082b565c0258efde2ae956cc7d00fe2da3b492be2ca376c7f0943","manifest_source_commit":"400f157e1815a0960fba38ac1a92b93a7dda37eb","manifest_validation_bytes":560,"manifest_validation_sha256":"b6dc423c243dba496dfb2f22918cafc8ee2e61566a2baac5a6bc67d5522f826f","operator_result":"PASS","original_ephemeral_evidence_limitation":"RECORDED","original_ephemeral_evidence_revalidation":"UNAVAILABLE","raw_evidence_committed":false,"remote_return_code":0,"remote_return_code_basis":"GOVERNED_OPERATOR_PASS_IMPLIES_VALIDATED_PASS_RC0","review_pi3_access":false,"review_production_mutation":false,"review_provenance":"OPERATOR_SUPPLIED_WINDOWS_EVIDENCE_REVIEW","run_directory_count":1,"run_id":"20261007T220653-46cef5aace9e","security":{"manifest_acl_protected":true,"manifest_owner":"AzureAD\\JorgeAzofeifaCastill","run_acl_protected":true,"run_owner":"AzureAD\\JorgeAzofeifaCastill","validation_acl_protected":true,"validation_owner":"AzureAD\\JorgeAzofeifaCastill"},"source_commit":"400f157e1815a0960fba38ac1a92b93a7dda37eb","status":"PASS","stop_required":true,"validation_bytes":560,"validation_sha256":"b6dc423c243dba496dfb2f22918cafc8ee2e61566a2baac5a6bc67d5522f826f"},"closure_predecessor":"400f157e1815a0960fba38ac1a92b93a7dda37eb","future_execution_requires_separate_authorization":true,"lifecycle":{"attempt_1":"FAIL_DURABLE_CAPTURE","attempt_2":"PASS","independent_production_acceptance":"PASS_CLOSED","pe4":"NOT_COMPLETE","phase7a":"ACTIVE","projection":"DEFERRED","rollback":"NOT_PERFORMED","scheduler":"NOT_STARTED","second_adapter_execution_authorized":false},"negative_evidence_by_codex":{"acceptance_execution":false,"adapter_execution":false,"credential_access":false,"ha_access":false,"historical_evidence_recreation":false,"pi3_access":false,"pi5_access":false,"production_execution":false,"production_mutation":false,"public_projection":false,"reconciler_execution":false,"remote_wrapper_execution":false,"retained_windows_evidence_access":false,"rollback":false,"scheduler_mutation":false,"surveillance":false,"windows_operator_execution":false},"next_objective":"PE-4 Home Assistant Association Adapter Scheduler Deployment","next_objective_status":"NOT_STARTED","next_operator_action":"PI3_SOURCE_SYNCHRONIZATION_TO_CLOSURE_COMMIT_ONLY_STOP_INDEPENDENT_REVIEW","original_ephemeral_evidence_limitation":{"disappearance_cause":"UNKNOWN","execution_time_comparison_recreated":false,"historical_evidence_recreated":false,"limitation":"RECORDED","present":false,"revalidation":"UNAVAILABLE"},"predecessor_parent":"27377b95658010bf35c2b1fab8009de3d6f24bb6","predecessor_subject":"PE-4: harden independent acceptance operator path","prerequisites":{"capture_correction":"PASS_CLOSED","native_windows_durability":"PASS","operator_path_integration":"PASS_CLOSED","pi3_source_synchronization":"PASS","preparation":"PASS_CLOSED","separate_attempt_2_authorization":"OPERATOR_SUPPLIED_COMPLETED","separate_durable_evidence_review":"PASS"},"privacy":"SANITIZED_OPERATOR_SUPPLIED_METADATA_AND_HASH_IDENTITIES_ONLY_NO_RAW_EVIDENCE","record_type":"PE4_HA_ASSOCIATION_INDEPENDENT_PRODUCTION_ACCEPTANCE_CLOSURE","repository_validation":{"diff_check":"PASS","environment":"SIGNED_IN_NATIVE_WINDOWS_CPYTHON_3_12_14_GIT_VISIBLE_BASH_SH_UNAVAILABLE_HIOC_TEST_SHELL_UNSET","focused":{"errors":0,"failures":0,"passed":21,"run":21,"skipped":0},"full_runs":[{"errors":0,"failure":"test_pe4_ha_auth_capability_client.ClientTests.test_run_stalled_send_failure_output_is_private","failures":1,"interpretation":"TIMING_SENSITIVITY_INFERRED_FROM_EXISTING_20MS_BUDGET_AND_FIVE_UNCHANGED_ISOLATED_PASSES","observed":"EXPECTED_ONE_SEND_OBSERVED_ZERO","passed":2000,"result":"FAIL","run":2048,"skipped":47},{"errors":0,"failures":0,"passed":2001,"result":"PASS","run":2048,"skipped":47}],"full_suite_repeated_without_test_suppression":true,"provenance":"CODEX_OBSERVED_REPOSITORY_ONLY_LOCAL_SYNTHETIC_WINDOWS_TESTS","relevant_pe4":{"errors":0,"failures":0,"passed":1307,"pattern":"test_pe4*.py","run":1323,"skipped":16},"runtime_and_existing_governance_unchanged":true,"unchanged_failed_test_isolated_recheck":{"errors":0,"failures":0,"passed":5,"run":5}},"schema_version":"1.0","source_synchronization":{"actions":{"acceptance_execution":false,"adapter_execution":false,"attempt_2_started":false,"credential_access":false,"ha_network":false,"production_mutation":false,"reconciler_execution":false,"scheduler_mutation":false,"second_adapter_execution_authorized":false},"active_git_operation":false,"ahead":0,"behind":0,"branch_after":"main","branch_before":"main","changeset_count":14,"changeset_validation":"PASS","final_operator_artifact_identity":"PASS","head_after":"400f157e1815a0960fba38ac1a92b93a7dda37eb","head_before":"16b7dd412cde7503ea45c62734915096654aa690","intermediate_commit":"27377b95658010bf35c2b1fab8009de3d6f24bb6","intermediate_subject":"PE-4: correct independent acceptance capture","origin_main_after":"400f157e1815a0960fba38ac1a92b93a7dda37eb","provenance":"OPERATOR_SUPPLIED","result":"PASS","return_code":0,"subject_validation":"PASS","successor_commit_count":2,"target_subject":"PE-4: harden independent acceptance operator path","two_commit_parent_chain":"PASS","worktree_clean_after":true,"worktree_clean_before":true},"sources":[{"commit":"400f157e1815a0960fba38ac1a92b93a7dda37eb","git_blob":"f771a3355f7fcaeb3cffe48ef2a57ab487c229a4","path":"governance/pe4/pe4-ha-association-independent-production-acceptance-operator-path.json","sha256":"d2ddce1ef2a173b5c1ed94e0426efcba5ddae7b0ca50d067120f748df8cb23c5"},{"commit":"400f157e1815a0960fba38ac1a92b93a7dda37eb","git_blob":"61fb0b5215eaa4aefca164d25c259f11b841d975","path":"governance/pe4/pe4-ha-association-independent-production-acceptance-capture-correction.json","sha256":"e1beddfca36153e9695ea712daa91e08414bc865afbf785b91fd13c79560ad85"},{"commit":"400f157e1815a0960fba38ac1a92b93a7dda37eb","git_blob":"d2d32ac29f579b7930795990d8d0db46dd048132","path":"governance/pe4/pe4-ha-association-independent-production-acceptance-preparation.json","sha256":"5187fd4fb18a18218e95b9c7732598738249296bfb9a9a23afdcdbd259bb16a8"},{"commit":"400f157e1815a0960fba38ac1a92b93a7dda37eb","git_blob":"08e0e4012185315b5bb801cf8cc68bb01eff5350","path":"governance/pe4/pe4-ha-association-durable-post-run-reconciliation-closure.json","sha256":"d5bf759331e95950bb5bc5a69310dfc502ffb67572fc363208c5c592fadfe983"},{"commit":"400f157e1815a0960fba38ac1a92b93a7dda37eb","git_blob":"2cd256b160793d71ce502041edb73046e8487d04","path":"docs/HIOC_MASTER_PLAN.md","sha256":"82ad201a5694bd267b617f9c70bac0850e25611ea697850722db7c1c0579a7c3"},{"commit":"400f157e1815a0960fba38ac1a92b93a7dda37eb","git_blob":"76238bf0e821121f14d0d92f1913bc308da11a10","path":"tools/hioc-pe4-ha-association-independent-acceptance.py","sha256":"fddc9c15ce9fd32fcc50c9d9506fa356e9f0dd3201e8a8d7efe8af8db8d90101"},{"commit":"400f157e1815a0960fba38ac1a92b93a7dda37eb","git_blob":"68377e945caae0c8b239702d699405de9685868c","path":"tools/hioc-pe4-ha-association-acceptance-operator.py","sha256":"06e55c7a7ae526b882c20d41adcb15190473919beb56562c09436f7e4841f720"},{"commit":"400f157e1815a0960fba38ac1a92b93a7dda37eb","git_blob":"38a026a5f664a71a6736606c00037ceb6861f34a","path":"tools/hioc-pe4-ha-association-acceptance-capture.py","sha256":"62828b6f4883a8bdac06d8f4964e859b2788d4a06547541bcccc013a0fd99320"}],"status":"PASS_CLOSED"}
